<?xml version="1.0" encoding="UTF-8"?>
<!-- edited with XMLSPY v5 rel. 3 U (http://www.xmlspy.com) by Alex Brown (Electronic Data Systems LTD) -->
<!--W3C Schema generated by XMLSPY v5 rel. 3 U (http://www.xmlspy.com)-->
<xs:schema xmlns:xs="http://www.w3.org/2001/XMLSchema" elementFormDefault="qualified">
	<xs:element name="PublicNotice">
		<xs:complexType>
			<xs:sequence>
				<xs:element name="CourtLogEvent" maxOccurs="unbounded">
					<xs:complexType>
						<xs:sequence>
							<xs:element name="DefinitivePublicNotice" maxOccurs="unbounded">
								<xs:complexType>
									<xs:simpleContent>
										<xs:extension base="xs:string">
											<xs:attribute name="defPNId" type="xs:string" use="required"/>
											<xs:attribute name="status" type="xs:string" use="required"/>
										</xs:extension>
									</xs:simpleContent>
								</xs:complexType>
							</xs:element>
						</xs:sequence>
						<xs:attribute name="Type" type="xs:string" use="required"/>
					</xs:complexType>
				</xs:element>
			</xs:sequence>
		</xs:complexType>
	</xs:element>
</xs:schema>
